<?xml version="1.0" encoding="UTF-8"?>
<zahtev:Zahtev xmlns="http://www.w3.org/ns/rdfa#"
    xmlns:zahtev="http://zahtev"
    xmlns:tipovi="http://tipovi"
    xmlns:xsi="http://www.w3.org/2001/XMLSchema-instance"
    xmlns:pred="http://www.xml.com/predicate/"
    xsi:schemaLocation="http://zahtev schema/zahtev/zahtev.xsd" 
    mesto="Sremska Mitrovica" 
    datum="2022-04-06"
    razresen="false"
    id="ID1"
    vocab="http://www.xml.com/predicate/"
    about="http://zahtev/ID1"
    rel="pred:vezanGradjanin"
    href="http://korisnik/pera@pera.com">
    <zahtev:Organ_vlasti>
        <tipovi:Naziv property="pred:primalacNaziv">Fakultet tehnickih nauka</tipovi:Naziv>
        <tipovi:Sediste>Novi Sad</tipovi:Sediste>
    </zahtev:Organ_vlasti>
    <zahtev:Telo_zahteva>
        <zahtev:Zakonska_osnova>
            <zahtev:Clan>15</zahtev:Clan>
            <zahtev:Stav>1</zahtev:Stav>
            <zahtev:Zakon>Zakon o slobodnom pristupu informacijama od javnog značaja</zahtev:Zakon>
            <zahtev:Sluzbeni_glasnik>
                <tipovi:Naziv>Službeni glasnik RS</tipovi:Naziv>
                <tipovi:Brojevi>
                    <tipovi:Broj>120/04</tipovi:Broj>
                    <tipovi:Broj>54/07</tipovi:Broj>
                    <tipovi:Broj>104/09</tipovi:Broj>
                    <tipovi:Broj>36/10</tipovi:Broj>
                </tipovi:Brojevi>
            </zahtev:Sluzbeni_glasnik>
        </zahtev:Zakonska_osnova>
        <zahtev:Zahtevi>
            <zahtev:Obavestenje>
            </zahtev:Obavestenje>
            <zahtev:Kopija>
            </zahtev:Kopija>
            <zahtev:Dostavljanje_kopije>
                <zahtev:Nacin_dostave>
                    <zahtev:Posebna_dostava>
                        <zahtev:Nacin_posebne_dostave>Golubom pismonosom</zahtev:Nacin_posebne_dostave>
                    </zahtev:Posebna_dostava>
                </zahtev:Nacin_dostave>
            </zahtev:Dostavljanje_kopije>
        </zahtev:Zahtevi>
        <zahtev:Zahtevane_informacije>Informacije o polozenim predmetima</zahtev:Zahtevane_informacije>
    </zahtev:Telo_zahteva>
    <zahtev:Trazilac>
        <tipovi:Ime property="pred:podnosilacIme">Vlastislav</tipovi:Ime>
        <tipovi:Prezime property="pred:podnosilacPrezime">Jakovljevic</tipovi:Prezime>
        <tipovi:Adresa>
            <tipovi:Mesto>Novi Sad</tipovi:Mesto>
            <tipovi:Ulica>Zeleznicka</tipovi:Ulica>
            <tipovi:Ulicni_broj>23</tipovi:Ulicni_broj>
        </tipovi:Adresa>
        <tipovi:Kontakt_podaci>063/452498506</tipovi:Kontakt_podaci>
    </zahtev:Trazilac>
</zahtev:Zahtev>